title,year,genre,movie_description,critical_consensus,review
Hancock,2008,"['Action', 'Fantasy', 'Comedy']","A scruffy superhero named Hancock (Will Smith) protects the citizens of Los Angeles but leaves horrendous collateral damage in the wake of every well-intentioned feat. That's OK with Hancock; he doesn't care what people think and is just as likely to be found dozing on a park bench as saving a damsel in distress. However, after saving the life of a PR executive (Jason Bateman) and meeting the man's beautiful wife (Charlize Theron), he realizes that he may have a sensitive side after all.","Though it begins with promise, Hancock suffers from a flimsy narrative and poor execution.","['A peculiar and occasionally charming poke in the ribs of the superman myth.', 'As delivered by director Peter Berg, Hancock is never as serious or funny or poignant as it could be. And despite clocking in at a reasonable running time, it has a big sag in the middle that nothing could have fixed.', 'As popcorn movies go, this is fleet, funny, and even thoughtful: its central question, nicely underplayed by director Peter Berg, is why power and altruism never seem to intersect.', 'As soon as the hero becomes another wounded demigod brooding on rooftops, the movie loses its sting.', ""Hancock isn't by any means a dead loss, but it could have been a lot better."", ""Hancock makes for one unexpectedly satisfying and kinky addition to Hollywood's superhero chronicles."", 'It becomes an entirely different film, one not really premised on the bad-superhero comedy idea, and the film is then oddly without a sense of humour, and its vague interest in satire vanishes completely.', ""It's definitely a mish-mash, but really good performances."", 'See-saws between straight superhero movie and parody, with layers of soap-opera fudge in between. A lot of solid scenes - but Hancock lacks the power of super-coherence.', 'Since The Pursuit of Happyness, actor-producer Smith has made no secret of his desire to make movies that entertain in that big-studio way but also dig deeper. Hancock is a rousing measure of that intent.', 'Some melodrama and a superwoman later, it loses steam.', ""The dynamic between the sullen Smith and sincere Bateman may be the best thing in the Peter Berg's movie, but it's a tough call because the whole popcorn fest is flat-out fantastic."", 'The problem is that director Peter Berg, aided and abetted by Smith and Theron and third banana Jason Bateman, seem to have made it literally, not realizing its out-of-whack tonalities and grotesque plot twists were meant to be played for laughs.', 'The strain of messianism in Will Smith movies is becoming ever more pronounced.', ""There's a great idea here, but it's buried within a muddled story that lurches between dark comedy and maudlin drama."", ""Train wrecks are intrinsically spectacular, and Will Smith's new movie offers a doozy. Two of them, in fact."", 'Why on earth anyone would want to waste a summer matinee afternoon with Hancock when they could get wasted with Shakes the Clown in the DVD privacy of their own lair?']"
Iron Man 2,2010,"['Action', 'Fantasy', 'Adventure', 'Sci-Fi']","With the world now aware that he is Iron Man, billionaire inventor Tony Stark (Robert Downey Jr.) faces pressure from all sides to share his technology with the military. He is reluctant to divulge the secrets of his armored suit, fearing the information will fall into the wrong hands. With Pepper Potts (Gwyneth Paltrow) and ""Rhodey"" Rhodes (Don Cheadle) by his side, Tony must forge new alliances and confront a powerful new enemy.","It isn't quite the breath of fresh air that Iron Man was, but this sequel comes close with solid performances and an action-packed plot.","[""As for the actual grand finale, Downey Jr. and Cheadle seem like they're already network gaming the PS3 release instead of facing any actual threat, and Rourke goes out like a chump."", 'Casting the likes of Downey and Rourke and then imprisoning them in jointed refrigerators is resource-squandering of the highest order.', ""Even the director...seems to view the heavy clanking of mechanized men as a bit of a chore: the kind of well-prepared yet unremarkable meat course that must inevitably follow the delightful amuse bouche of Robert Downey Jr.'s portrayal of Stark."", ""I don't think the story was nearly as strong as that of The Dark Knight, but it sure was entertaining and surprisingly funny... and sets up The Avengers quite nicely."", 'If there were any new ideas, I failed to spot them, as did my bone marrow, which slept through most of it anyhow.', ""If you're just going to see men in robot suits blow each other up while classic rock blares on the soundtrack, Iron Man 2 will do just fine..."", 'Iron Man 2 suffers from typical sequelitis. It bites off more than it can chew and feels drowsy as a result.', ""It's a solid blockbuster with a few faults that you just don't mind overlooking."", ""It's enjoyable to see a quality superhero dynamically and enthusiastically rendered."", ""Like the original this is a movie I don't particularly mind but don't exactly love, either."", 'Robert Downey Jr. as Iron Man? OK, pretty good. Robert Downey Jr. as Tony Stark? Brilliant.', 'Rourke puts a human face, albeit a bashed one, on comic book villainy.', 'Superhero Stark remains intriguing.', ""The best scenes are still the ones with Downey and Gwyneth Paltrow (as Stark's charm-resistant assistant, Pepper Potts), or just Downey alone."", 'The movie settles into a series of ho-hum conflicts and complications, and the requisite slam-bang ending is perfunctory at best.', ""The whiz-bang stuff here -- while never less than slick -- doesn't produce anything we haven't seen before."", ""There's an outdated feel to it all, from its cold-war view of America to the AC/DC soundtrack."", 'This sequel, alas, settles for old elements in a new alloy -- less iron, lots more lead and tin.', 'Those who wait through all of the credits will get a glimpse of what is in store for the next superhero saga. I hope between now and then they remember that less is more.', '[Downey] gives Iron Man 2 its fascination. The rest is a cluttered, clattering toy story.']"
Logan,2017,"['Action', 'Fantasy', 'Adventure']","In the near future, a weary Logan (Hugh Jackman) cares for an ailing Professor X (Patrick Stewart) at a remote outpost on the Mexican border. His plan to hide from the outside world gets upended when he meets a young mutant (Dafne Keen) who is very much like him. Logan must now protect the girl and battle the dark forces that want to capture her.","Hugh Jackman makes the most of his final outing as Wolverine with a gritty, nuanced performance in a violent but surprisingly thoughtful superhero action film that defies genre conventions.","['Another expensive throwaway aimed at milking money out of people who still read comic books. Color it stupid.', ""Credit where it's due: this is a grown-up movie that's a drama first and superhero story second. Maybe you shouldn't give points for effort, but maybe you should when you're talking about a subset of films as locked-in to their formulas as these."", ""Fans of Marvel, X-Men, and the Wolverine character should be pleased with Logan-it's a strong finale and arguably the best in this highly uneven spin-off series."", ""Jackman and Stewart are why Logan works-why the film doesn't feel like a cheap exercise in bloody violence, and its subversion of typical superhero-movie tropes feels organic."", 'Jackman gives Logan a withering rage that seems heartfelt, not hammy; Stewart is touching in his enraged befuddlement; and Keen, who resembles here what Katie Holmes might look like if she were Carrie, has a feral intensity.', 'Jackman is, once more, superb, holding down the whole film: no matter how battered, gnarled and shrubby he looks, you always root for him. A bit of a beast - but our beast.', ""Jackman twists the pain at the centre of the hero's struggle into remarkably uncomfortable places for a blockbuster."", ""Jackman's performance is Clint Eastwood-esque, and the lines in Jackman's face tell the story of his worn character; he plays Wolverine as a man at the end of his line, adding at least a decade to his 48 years."", 'Logan does go defiantly against the grain by favouring melancholic mood and themes of mortality and deterioration over inflated, end-of-the-world stakes or grandiose action pyrotechnics.', 'Logan is a fine example of the superhero film where fantasy is tame and reality is wild.', 'Logan is a melancholic paen to the Western with enough blood and gore to redefine what a comic book movie can and should be.', 'Logan ventures to all the places superhero movies have tended not to go.', 'Make no mistake, Logan earns its tears. If Jackman and Stewart are serious about this being their mutual X-Men swan song, they could not have crafted a more heartfelt valedictory.', ""Strips away the spandex, the posse and the chaos, distilling the story down to the essence of the man, Logan. What's left is the agony and the ecstasy of mutanthood."", 'The ending of ""Logan""... works in a bold and poignant way, providing the kind of closure that any story could be proud of.', 'The superhero movie is a major American genre, and one that is malleable for the silly and the profound. And Logan is the most profound one yet.', ""This isn't just a great comic book movie, isn't just a superb X-Men adventure, it's a fantastic motion picture, period, and Mangold, Jackman and everyone else involved with its creation should be more than proud of what it is they've accomplished."", 'Tightly plotted and ruthlessly bloodthirsty, this is an impressive return to form for the X-Men franchise.', 'Whenever the filmmakers have a choice between cruelly slaughtering characters and letting them live, they almost always choose the cruel path.', '[Director] Mangold drags [Wolverine] - much older, if not much wiser - into a Western, and ends up with the best superhero movie in recent memory.']"
X-Men: Apocalypse,2016,"['Action', 'Fantasy', 'Adventure', 'Sci-Fi']","Worshiped as a god since the dawn of civilization, the immortal Apocalypse (Oscar Isaac) becomes the first and most powerful mutant. Awakening after thousands of years, he recruits the disheartened Magneto (Michael Fassbender) and other mutants to create a new world order. As the fate of the Earth hangs in the balance, Professor X (James McAvoy) and Raven (Jennifer Lawrence) lead a team of young X-Men to stop their seemingly invincible nemesis from destroying mankind.","Overloaded action and a cliched villain take the focus away from otherwise strong performers and resonant themes, making X-Men: Apocalypse a middling chapter of the venerable superhero franchise.","[""'X-Men: Apocalypse' gives 'X-Men: The Last Stand' a run for its money as the worst entry in the long-running franchise."", ""Arguably, no one knows the 'X-Men' saga like Bryan Singer and his stalwart production team, which is evident when playing with characters and timelines, as they've done in the past, and do so expertly here."", 'At almost two-and-a-half hours, in spite of collapsing cities, new characters and a Wolverine cameo, X-Men: Apocalypse offers so little over such a long running time.', 'Comic fans will be mystified. Movie fans will be confused. Everyone will leave disappointed.', ""Compared to Batman v Superman: Dawn of Justice (a convoluted snore) or Captain America: Civil War (bombastic and contrived) X-Men: Apocalypse is the one that's worth the price of admission."", 'Enough already. Singer throws so much mutant at us that nothing sticks. I was almost rooting for Trump to impose a quota.', ""I love these conflicted misfits, even when they're fighting a supreme being who seems imported from a far inferior, less interesting world."", 'I still liked his latest X-Men effort quite a bit, flaws and all, the aspirations fueling it almost as super as they are heroic.', ""It wasn't terrible, and I don't think it entirely deserves its dismal 47 percent rating on Rotten Tomatoes. But it should serve as a wake-up call regarding the franchise's future direction."", ""It's basically a closing chapter to a feeble trilogy that started out pretty well and then ran out of gas, and now must serve as a prequel to shadowy X-related endeavors yet to come."", ""It's not the first deflating X-Men picture, but it's the first from director Bryan Singer, who now has four of these under his belt, including the original."", ""Say what you will about 'Apocalypse,' it's hard to know what damn fool thing Singer's gonna do next. See enough of these movies, and you start to value that quality."", ""Some of the franchise stalwarts, such as Jennifer Lawrence's Mystique, are given too little to do. Most are given too much."", 'The X-Men franchise gets bigger with Apocalypse, which brings the mutants face-to-face with the end of the world ... but the story lacks any danger.', 'The movie seems dull and bloated.', 'The set-up is sometimes quite intriguing. Especially when it features Michael Fassbender as Magneto (massively magnetic).', ""There's no spark, and everyone lumbers through the motions. The apocalypse, it turns out, is deadly dull."", ""This is one of the big dangers for the extended franchise model of filmmaking -- that characters and series will be kept alive not because there's a story to tell, but because the franchise must be kept alive."", 'Time for X to take some zzzz, perhaps.', ""Without a compelling villain, it's hard to resist feeling like it's just more of the (mutated) same.""]"
Venom: Let There Be Carnage,2021,"['Adventure', 'Fantasy', 'Action', 'Sci-Fi', 'Comedy']","Eddie Brock is still struggling to coexist with the shape-shifting extraterrestrial Venom. When deranged serial killer Cletus Kasady also becomes host to an alien symbiote, Brock and Venom must put aside their differences to stop his reign of terror.","A sequel aimed squarely at fans of the original's odd couple chemistry, Venom: Let There Be Carnage eagerly embraces the franchise's sillier side.","['A love story written in blood, sweat and the slime of half-eaten brains.', 'Andy Serkis is no stranger to the necessities of making a digital character feel tactile, and that shows in his direction.', 'At a tight 90 minutes, Serkis\' sequel doesn\'t feel long, but it is exhausting. It\'s an entire movie pitched at 11 that screams in your face, ""YOU SHOULD BE HAVING FUN.""', ""Besides being nasty, the new movie is quite jokey. This wouldn't be a tonal issue if the jokes were good, but they're not."", 'Extraordinarily poor.', 'I actually had a riot and enjoyed it.', ""If 2018's Venom felt like an afterthought, then the sequel, Venom: Let There Be Carnage, feels like an afterthought to an afterthought."", ""It's all very weird, and yet not half-weird enough. Strained edginess mingles with strained sentiment, and also with gags that would make your great-grandfather roll his eyes."", ""It's dumb. It's loud. It barely makes a lick of sense. But unlike its predecessor, this second cinematic outing for the popular Marvel antihero is also a heck of a lot of fun."", ""It's nice to be able to appreciate a superhero movie that understands how scary the world can be even if you have literal superpowers, and that there's something beautiful in not going it alone."", ""It's not perfect, but it sure is fun."", 'Serkis dispenses with detailed explanations and instead amps up the humour, leaning into the goofy, flirtatious dynamic between Venom and Brock.', 'Serkis... seems to be trying to duplicate the energy of a kid tearing through a comic book.', 'That fierce kineticism has failed to coalesce into a quasi-coherent sequel. Venom 2 is certainly riotous, but where did the fun go?', ""There's a little bit more polish this time, but for all the talented people involved,Let There Be Carnage still has the whiff of a turd in the wind."", ""This sequel is a violent, very sloppy, yet entertaining battle through couples counseling for Tom Hardy's Eddie and his symbiote."", ""Unusual to say the least...there is some deadpan humor to what it's doing...and I kind of enjoyed Tom Hardy..."", 'Venom: Let There Be Carnage is refreshingly nuts, and benefits from being a whole 45 minutes shorter than its predecessor.', ""Venom: Let There Be Crazy, Stupid Love isn't a great movie, but it doesn't matter because it's just big, dumb, romantic fun."", 'Where the first Venom was toxically dull, Venom 2, at its best, is intoxicating.']"
Godzilla vs. Kong,2021,"['Action', 'Sci-Fi', 'Adventure']","Legends collide in ""Godzilla vs. Kong"" as these mythic adversaries meet in a spectacular battle for the ages, with the fate of the world hanging in the balance. Kong and his protectors undertake a perilous journey to find his true home, and with them is Jia, a young orphaned girl with whom he has formed a unique and powerful bond. But they unexpectedly find themselves in the path of an enraged Godzilla, cutting a swath of destruction across the globe. The epic clash between the two titans--instigated by unseen forces--is only the beginning of the mystery that lies deep within the core of the Earth.","Delivering squarely on its title, Godzilla vs. Kong swats away character development and human drama to deliver all the spectacle you'd expect from giant monsters slugging it out.","[""A distracting jumble that reduces the stakes of the movie's mighty showdown nearly to a vanishing point, and turns the title titans and their other colossal cohorts into the incredible shrinking monsters."", 'As the climax of a bitty and uneven franchise, Godzilla vs Kong is profoundly silly - and all the more enjoyable for it.', 'At home with its own sense of fun and precise in the organisation of its cacophonous digital action.', 'Big, dumb, city-destroying fun...', 'Consider this one a draw.', 'Exactly the blunt, escapist dazzle you need in the middle of a pandemic.', 'Forgive the exposition dump in the convoluted plot and go for a clash of the titans that is spectacular in every sense of the word.', ""It sprints through plot and dialogue like it's offended at the suggestion it needs them, and throws only the most basic of foundations together."", ""It's big, dumb fun that should be seen on the biggest screen you feel comfortable with."", ""It's exactly what you think it is, no more no less. It's a shame because there are elements of a more interesting movie here..."", ""It's hard to believe that human minds conceived the story line of Godzilla vs. Kong -- not because it's so intricate, elegant or spiritually elevated, but because it's so incoherent and idiotic."", ""It's just tricky to try to make something look convincingly state-of-the-art and gloriously cheesy at the same time... What's missing is the fleeting but genuine awe that Gareth Edwards conjured up in Godzilla..."", 'The CGI-created creatures that now populate these movies will never have the pure, stop-motion soul of the miniatures used in earlier films; somehow, especially as filtered through memory, those figures seem more real than real.', 'The film looked terrific. There is some imagery here that honestly took my breath away.', 'The final battle in a neon-saturated Hong Kong is a thing of absolute beauty.', ""This isn't the best big bruiser extravaganza ever made, but your eyes will stay glued to the screen, your eardrums will pound and heartrate will increase."", ""Vastly superior to 2019's muddy Godzilla: King of the Monsters..."", 'We want colourful carnage. We want mindless destruction. We want one giant thing hitting another giant thing, and maybe one of those things could also be holding a giant glowing radioactive axe, maybe? Sure! Give the people Godzilla vs. Kong.', ""Wingard regularly opts for visual flourishes, imaginative diversions (a lovely second-act sequence takes place at the Earth's core) and the kind of mammoth energising punch-ups that suggest there's life yet to be harnessed from this age-old monster mash."", '[I]n fact the new film, directed by Adam Wingard and written by a small committee, has an amusingly high order of scientific monster-movie mumbo-jumbo, delivered with serious intonations by well-respected actors as they stare in awe at a green screen.']"
Avatar,2009,"['Action', 'Fantasy', 'Adventure', 'Sci-Fi']","On the lush alien world of Pandora live the Na'vi, beings who appear primitive but are highly evolved. Because the planet's environment is poisonous, human/Na'vi hybrids, called Avatars, must link to human minds to allow for free movement on Pandora. Jake Sully (Sam Worthington), a paralyzed former Marine, becomes mobile again through one such Avatar and falls in love with a Na'vi woman (Zoe Saldana). As a bond with her grows, he is drawn into a battle for the survival of her world.","It might be more impressive on a technical level than as a piece of storytelling, but Avatar reaffirms James Cameron's singular gift for imaginative, absorbing filmmaking.","[""Avatar is a joyous celebration of story craft and the visual possibilities of cinema. Cameron had set his sights on taking the technology of film where no one had gone before. And he delivers. Avatar is stunning. Cameron and Peter Jackson's Weta Digital h"", ""Avatar is a phenomenon you can't ignore, monumentally imposing and done with extraordinary expertise - but the same could be said of the Dubai skyline, and I'm not sure that represents any future worth investing in."", ""Big money, big risk, pretty big reward. That's been his consistent pattern, and it's high time to give credit where credit is overdue: James Cameron delivers."", 'Cameron and his legion of CGI experts and skilled craftspeople have delivered a lovely, misty, dangerous world.', 'Cameron knows the viewer will recognize Avatar\'s story from elsewhere, whether as the love affair between John Smith and Pocahontas or almost all of Ferngully and so tries to dazzle the viewer with ""shock and awe.""', 'Five hundred million dollars [wasted].', 'From the music to the muse, this is clearly a James Cameron flick, clearly a masterpiece, and clearly marks a revolution in blockbusters, for if you only see one film in a 3-D cinema this year, make it Avatar.', ""I had the feeling coming out of this movie that I haven't felt since maybe I was eleven years old in 1977 and I saw Star Wars for the first time."", 'I have seen the future of movies, and it is Avatar.', 'In my opinion, Avatar has been hyped beyond the point of forgiveness.', 'It\'s a remote-control movie experience, a high-tech ""wish you were here"" scribbled on a very expensive postcard.', 'Learning your visuals from Jack Kirby is one thing, but too often it sounds like Cameron learned to write dialogue from the guy too.', ""Overall, Avatar was really about the jaw-dropping visual effects--that's the great thing about it."", ""Rewatching it with fresh eyes 10 years later, the movie's pluses and minuses both rise into much starker relief. The verdict: It's...fine."", 'The most-hyped movie of the year just about merits it.', 'The narrative would be ho-hum without the spectacle. But what spectacle! Avatar is dizzying, enveloping, vertiginous ... I ran out of adjectives an hour into its 161 minutes.', '[Cameron] is still the king of action and suspense, the last third such a visceral whirlwind of kinetically staged mayhem my eyes almost popped right out of their sockets.', 'if it runs out of imagination and even some credibility when it comes to the plot, well, there is still enough on the screen to qualify as entertaining eye candy.']"
