title,year,genre,movie_description,critical_consensus,review
Get Out,2017,"['Mystery, Thriller & Horror', 'Comedy', 'Mystery, Thriller & Horror']","Now that Chris and his girlfriend, Rose, have reached the meet-the-parents milestone of dating, she invites him for a weekend getaway with Missy and Dean. At first, Chris reads the family's overly accommodating behavior as nervous attempts to deal with their daughter's interracial relationship, but as the weekend progresses, a series of increasingly disturbing discoveries leads him to a truth that he never could have imagined.","Funny, scary, and thought-provoking, Get Out seamlessly weaves its trenchant social critiques into a brilliantly effective and entertaining horror/comedy thrill ride.","['Beneath the beatific smile of 21st-century liberalism, Get Out finds the still grinning ghoulish skull of age-old servitude and exploitation unveiled during a rollercoaster ride into a very American nightmare.', ""By focusing the storyline on a particular form of racism -- the kind that's often disguised as peculiar envy -- Get Out reveals something more insidious."", 'Everything in Get Out seems innocuous on first blush.', 'In a double whammy of satire, Get Out upends all the expected tropes of the horror movie and gives middle-class white liberals a thorough skewering.', 'Is it too early to call this a modern genre classic?', ""It's Guess Who's Coming to Dinner made over in the spirit of Rosemary's Baby, with accessories inspired by Meet the Fockers."", ""It's a brilliantly mischievous, unsettling movie."", ""It's a game-changer."", ""Jordan Peele's semi-parodic horror film Get Out has a complexity worthy of its historical moment."", 'Kudos to Peele for tackling a painful subject in such a massively entertaining and thoroughly memorable fashion. [Full review in Japanese]', ""Mostly [Peele] creates a lovely, off-kilter mood, riffing with tremendous visual poise on all sorts of classics, including Seconds, Guess Who's Coming to Dinner and The Stepford Wives."", ""Peele plays the suspense like a maestro wielding a Stradivarius - each tightly wound string used to create a sense of foreboding and anticipation that Hitchcock himself would've been jealous of."", 'Peele seduces, subverts and manipulates audience expectations - as the masters Alfred Hitchcock, John Carpenter, and Stanley Kubrick did before him.', ""Peele succeeds where sometimes even more experienced filmmakers fail: He's made an agile entertainment whose social and cultural observations are woven so tightly into the fabric that you're laughing even as you're thinking, and vice-versa."", 'The film has more to do with discomfort and envy than blind hatred. What a strange marvel it is.', 'The most forceful and inventive American horror film since It Follows.', 'This brilliantly provocative first feature from comic turned writer-director Jordan Peele proves that the best way to get satire to a mass audience is to call it horror.', ""To call it the most important movie of the year so far makes it sound possibly rather worthy. That's not true at all. Get Out is a comment on a highly complex situation that's also a total blast."", ""What makes [Get Out] a worthwhile experience is Jordan Peele's skillful genre intervention."", '[Director] Peele, who also scripted, is very good at writing barbed dialogue, and as the film proceeds the audience is likely to feel as uncomfortable as Chris.']"
Us,2019,"['Mystery, Thriller & Horror', 'Mystery, Thriller & Horror']","Accompanied by her husband, son and daughter, Adelaide Wilson returns to the beachfront home where she grew up as a child. Haunted by a traumatic experience from the past, Adelaide grows increasingly concerned that something bad is going to happen. Her worst fears soon become a reality when four masked strangers descend upon the house, forcing the Wilsons into a fight for survival. When the masks come off, the family is horrified to learn that each attacker takes the appearance of one of them.","With Jordan Peele's second inventive, ambitious horror film, we have seen how to beat the sophomore jinx, and it is Us.","[""... it achieves an insidious, lingering effect that's rarer in the horror genre."", '...[A]ll the elements of the production work together to create an atmospheric menace that occupies a breathless two-thirds of the high-intensity 116-minute running time.', 'A sharp, often funny meditation on the terrifying power of human connection.', ""Ambition in the horror genre can be a good thing, but the overreach in this movie detracts from both the horror and the ambition. Having said that, Peele shows a marked advance in filmmaking skills here and, in her dual role, Nyong'o is ferociously good."", 'Even as the central characters are enveloped by doom, Peele provides a haunting image of a black family that is both unsuspecting and frighteningly unfuckwithable.', 'Every element in this film serves a purpose and is set up like a chess move, from the soundtrack to the detailed production values. (Be sure to check out the old VHS tapes in a flashback sequence).', 'Fearsomely entertaining, consistently thought-provoking and occasionally bloody scary.', ""For all its unevenness and confusion, cannot be dismissed. Something genuinely urgent seems to be happening, especially in the performances by Nyong'o and, to a lesser extent, Moss."", ""I love the performances, but I'm just not super sold on the script, to be honest... I'm really ready for [Jordan Peele] to be his own voice now."", 'If Get Out was a dagger, Us is a storm cloud.The new picture is also, in some ways, more assured than Get Out in the way it delivers traditional but effective genre pleasures.', ""It's one thing for a movie to humble you by leaving you unsure about yourself and your place in the world; it's another for it to leave you wondering what, exactly, a filmmaker is trying to use his formidable verbal and visual vocabulary to say."", 'Peele develops a genuinely thrilling, heart-in-the-throat-scary horror picture.', 'Peele seems to lay bare the tremendous anxiety among the members of this family to maintain ""respectability,"" that odious burden so essential to racism\'s armature.', ""The joy of it, what makes the film a severe accomplishment, is that it can be a fun ride no matter how overstuffed. But only if, ignoring the film's prompts to mean more, you let it."", ""The real genius at work in Us is Nyong'o, who anchors the story with underlying rage as well as the protective qualities usually reserved for male leads."", ""This film, unlike its predecessor, isn't perfect. But it is a richly intriguing riot of imagery and ideas that demands to be rewatched again and again."", 'Us is a horror movie that poses a couple of simple questions; ""Who are we?"" and ""How can we be sure, who we are?"" Questions about which Peele speculates, wildly.', 'Us is more sensory experience than thinkpiece.', ""Us revolves around an allegory that's more elastic and resistant to parsing than megahit Get Out."", ""With his second feature, Peele completely obliterates the concept of a sophomore slump, debuting what will go down as the first true, soon-to-be-iconic horror classic that we've seen in many, many years.""]"
Glass,2019,"['Mystery, Thriller & Horror', 'Drama & Romance']","David Dunn tries to stay one step ahead of the law while delivering vigilante justice on the streets of Philadelphia. His special talents soon put him on a collision course with the Beast -- the psychotic madman who has superhuman strength and 23 distinct personalities. Their epic showdown leads them to an encounter with the mysterious Elijah Price, the criminal mastermind who holds critical secrets for both men.","Glass displays a few glimmers of M. Night Shyamalan at his twisty world-building best, but ultimately disappoints as the conclusion to the writer-director's long-gestating trilogy.","['""Glass,"" it turns out, is broken.', 'For those intrigued but not anticipating too much, it\'s the sort of flawed but reasonably entertaining effort that can be viewed as ""Glass,"" half full.', 'Frustrating and mediocre, and not the Unbreakable sequel many fans have waited 18 years for. McAvoy impresses once again, however the lack of narrative rigour makes it hard to care.', 'Hollywood and its superhero franchises are all but coextensive, and Shyamalan\'s confrontation with the ubiquity, popularity, and dominance of superheroes gives ""Glass"" a second-level urgency.', ""I went with it... I thought this was Shyamalan's best film since Signs."", ""It is a successful movie on its own terms and an ideal closing chapter to M. Night Shyamalan's Eastrail 177 trilogy."", ""It's good to have him back. It's a great looking film, it's great storytelling, and again he really takes his time."", ""Most filmmakers today don't take risks of this scale with original stories. Shyamalan didn't take the safe route, and in so doing, will polarize audiences."", 'Shyamalan - back on the downward swoop of his career sine-wave - inadvertently demonstrates that the Unbreakable punchline cannot sustain even casual analysis.', ""Shyamalan is incredibly gifted. He's also suffering from delusions of grandeur."", 'The concept is intriguing but the emotional payoff is negligible, the surprise ending is feeble and the whole enterprise resembles a recycling bin.', ""The metaphors are messy (trauma makes people extraordinary?) and the pacing's off, but it's fun to see the individual films' universes crossing over."", ""There are a few thoughtfully placed cameras and thrilling moments - Bruce Willis vs. a door, for one - but they're not nearly enough to make this self-conscious live-action comic book worthwhile."", 'This is a gripping, intelligent psychological thriller that is lifted beyond ""normal"" by McAvoy and all the people inside him.', ""This may not be M. Night Shyamalan's worst movie, though it's surely his most disappointing."", ""What's disappointing isn't that Shyamalan chose not to make Unbreakable 2; it's that what began so successfully with Unbreakable has devolved into such thoroughly unsatisfying pulp, void of any real humanity."", 'Why was Shyamalan, who has directed at least four objective failures over the course of his career, allowed yet another chance to prove what a disappointment he can be?', ""With a movie jumping from character to character so often, it just didn't have flow or pacing or tone."", ""You have to admire Shyamalan's efforts to deconstruct a genre that he evidently loves, yet there is just so little to haunt or to fool us in the result, and a few sharp laughs might have helped his cause."", 'You have to admire the nerve of Shyamalan for attempting something like this-and indeed, for choosing Glass as the title for a film so unashamedly non-transparent.']"
Dark Shadows,2012,"['Comedy', 'Fantasy']","In 18th-century Maine, Barnabas Collins (Johnny Depp) presides over the town of Collinsport. A rich and powerful playboy, Barnabas seals his own doom when he breaks the heart of a witch named Angelique (Eva Green). Angelique turns Barnabas into a vampire and buries him alive. Two centuries later, Barnabas escapes from his tomb and finds 1972 Collinsport a very different place. His once-grand estate has fallen into ruin, and the dysfunctional remnants of his family have fared little better.","The visuals are top notch but Tim Burton never finds a consistent rhythm, mixing campy jokes and gothic spookiness with less success than other Johnny Depp collaborations.","['""Dark Shadows has to be the most perfunctory, most self- parodic entry to the [Burton] canon thus far.""', '""Dark Shadows\'\' certainly has its moments, especially when Barnabas and Angelique hilariously wreck her office during a surreal, CGI-fueled, PG-rated tryst.', ""'Dark Shadows' is an amusing piece of high camp, stoked by Depp's deadpan star performance and the kind of elaborate trappings one would expect from Burton."", ""After watching the film, an odd, somewhat disjointed comedic drama about family and sacrifice set to Burton's own uniquely macabre cinematic beat, I'm not quite sure what to call this new take on the venerable property."", 'At once a brash, strutting pop culture pastiche and gloomy exercise in self-cannibalizing nostalgia, ""Dark Shadows"" is depressing on myriad levels.', ""Can't decide whether it's a parody, a horror comedy, an atmospheric melodrama, or a tedious bucket of crap. Eventually it chooses the last one."", 'Certainly delivers the goods on several levels without quite rising to the heights to which it aspires.', 'Clearly, they made the movie they wanted to make. It\'s just not the movie this ""Dark Shadows"" fan hoped to see.', ""Dark Shadows' only meaningful relationship is between Depp and his audience. He's a persona now, no longer an actor."", ""Fans of Depp's past collusions with Burton will find their rewards along the way. But there's a perfunctory vibe to the goings on, a weariness amid the weirdness."", 'Feels less like a fond and knowing tribute than a work of indifferent, uninspired hackery.', 'How bad is ""Dark Shadows""? It makes you long for a ""Twilight"" movie. That\'s bad.', 'It is at any rate better value than the disappointing Alice in Wonderland.', ""Mostly Dark Shadows is silly when we're trained to expect slightly richer fun from Burton and Depp."", 'Rarely has a film more aptly proven the ""more is less"" theory - part comedy, part horror, part \'70s spoof, part soap opera. And yet none of the genres in this mash-up are the least bit successful.', 'Sad to report, the [Tim] Burton opus is an unnecessarily complicated tale involving too many characters, not to mention an unresolved moral conundrum that has us happily rooting for an unapologetic mass serial killer.', 'The only reason to see Dark Shadows is to discover how dire and pointless-how flat-out dreadful-a movie can be even when it has Tim Burton, Johnny Depp, Michelle Pfeiffer, and Helena Bonham Carter attached to its flimsy pretext.', 'This is not so much a coherent movie as it is a long, expensive joke in search of a purpose.', 'Wonderfully weird visuals from Tim Burton and a highly watchable performance by his muse, Johnny Depp cannot keep the tone from faltering and the results are unsatisfying.', 'You may not care much for what happens to the characters, but there sure is a lot to ogle while they go about their nonsensical business.']"
Alien: Covenant,2017,"['Mystery, Thriller & Horror', 'Mystery, Thriller & Horror', 'Sci-Fi']","Bound for a remote planet on the far side of the galaxy, members (Katherine Waterston, Billy Crudup) of the colony ship Covenant discover what they think to be an uncharted paradise. While there, they meet David (Michael Fassbender), the synthetic survivor of the doomed Prometheus expedition. The mysterious world soon turns dark and dangerous when a hostile alien life-form forces the crew into a deadly fight for survival.","Alien: Covenant delivers another satisfying round of close-quarters deep-space terror, even if it doesn't take the saga in any new directions.","[""As redesigns go, Alien: Covenant is not ambitious, but it's roaringly, repulsively effective."", ""Covenant works best when it's honoring Alien and massively fails when it hearkens back to Prometheus."", ""Director Ridley Scott clearly wants to give us more than *just* an 'Alien' movie. But his film is best when it aims for that simple goal."", ""Even if the twists and turns in the plot aren't too hard to see coming, there's a distinct joy that [Ridley] Scott takes in setting up and setting off each of those traps."", ""If this is your idea of a good time, you can tick away the film's two-plus hours guessing which crew members will get offed, and in what order."", 'In space, no one can hear you laugh.', ""It's an Alien movie for our times, one in which mankind isn't just under the thumb of an oppressive corporation but sowing the seeds of its own destruction on a more sweeping scale."", ""Peel away the big budget genre film's veneer of Western Civ for Dummies (Michelangelo, Wagner, Byron and Shelley) and what you have is rather conventional Lego blocks of sci-fi horror."", ""Sure, there's more blood, and guts, to appease fans, but at what cost?"", 'The first ""Alien"" had better special effects. Watch it instead.', 'The new film is intended to act as several things, none of them particularly admirable.', 'There are plenty of reasons to shut your eyes and cross your legs while watching this film, but is that the same as being scared?', ""There's an air of mystery to Alien: Covenant that the movie can't live up to, because for all its interest in what it all means, it has relatively little to show for all that idle questioning."", 'This desire for procreation and preservation of the self - human, alien or artificial - is what motivates every being in the Alien universe, and in Covenant, Scott sets up a thrilling thunderdome in which we can watch this bloody battle unfold.', ""This may not be a movie that reinvents the wheel. But it's one that knows how to make it roll."", 'Unfortunately, Alien: Covenant is not really up to bearing the weight of the yarn it wants to spin.', ""Unfortunately, it starts off like you're getting a sequel to Prometheus."", 'While it may sometimes exceed its own reach, Covenant extends a grasp so impressively audacious, it might as well come from a director with nothing to lose.', ""Yet again a crew sniffs after a mysterious ping and sticks their nose in a deadly larva pod. Are our astronauts learning? God no. And if the audience expected a different plot, we're not learning, either."", ""Yet director Ridley Scott -- who birthed the original nearly 40 years ago as well as that last film -- plunges back into the latter's mythology, with equally uninspired and perhaps more blatantly derivative results.""]"
Resident Evil: Retribution,2012,"['Action', 'Mystery, Thriller & Horror']","As Umbrella Corp.'s deadly T-virus continues to turn the world's population into legions of flesh-eating zombies, Alice (Milla Jovovich), the human race's last hope, awakes deep within Umbrella's secret operations facility. The further she delves into the complex, the more of her mysterious past is unveiled. Her global hunt for those responsible for the outbreak leads to a mind-blowing revelation; Aided by friends old and new, Alice fights to escape from a world on the edge of oblivion.",Resident Evil: Retribution offers everything one might reasonably expect from the fifth installment in a heavily action-dependent franchise -- which means very little beyond stylishly hollow CGI-enhanced set pieces.,"['A maniacal montage of cartoonish battle sequences.', 'A zombie plague may have laid waste the world, but apparently supplies of black leather unitards have yet to be exhausted.', ""Anderson's action chops are undeniable - but Resident Evil: Retribution might be one of the dumbest things ever crafted by human hands."", 'At this point in the franchise, Anderson is content to alight the saga on a perpetual rewind loop, ever-ending, ever-rebooting, all subsidized by his nonpareil compositional sense.', 'Diagramming every revolution of Jovovich in wheeling and whirling action, however, Anderson is pitch-perfect when singing the body electric.', ""During the film's final sequence the director explains all while also suggesting that the franchise's nuttiest days are, remarkably, yet to come."", 'Endless video-game-style, violent mayhem is on display in this latest edition of the mind-numbing apocalypse series.', 'If they ran these scenes at normal speed, would 95 dreary minutes become a much more expedient 20 to 25?', ""It's all the same blah-blah carnage as the first four flicks, with 3D effects hurling blood, blades and body parts into the audience amid a non-stop barrage of gunfire and explosions."", 'Like an established pizza chain, director Anderson is in thrall to a guarantee: all relationships, of any significance, will be established in three seconds or less.', 'Nobody goes to a Resident Evil movie expecting a classic but this fifth entry in the series is just plain cruddy.', ""Resident Evil movies don't tell stories so much as they provide variations on a theme, and that theme is: a pubescent boy's wet dream recast as an antiseptic dub-step nightmare"", 'Some sequels suggest that no one involved with a franchise really cares anymore.', ""The acting is sometimes shockingly bad, but generally the script doesn't ask much of the actors, and the combat is effectively staged and often thrilling."", ""The film's extravagant action scenes have not a whiff of consequence to them, and other than Alice, the foremost quality of all of the characters is their disposability."", 'The script is incoherent and the acting is terrible -- avatars would have been an improvement.', 'Thuddingly awful.', ""Writer-director Paul W.S. Anderson ... attempts to fill out a flimsy plot structure by making the characters' comings and goings overly convoluted.""]"
Constantine,2005,"['Fantasy', 'Mystery, Thriller & Horror']","As a suicide survivor, demon hunter John Constantine (Keanu Reeves) has literally been to hell and back -- and he knows that when he dies, he's got a one-way ticket to Satan's realm unless he can earn enough goodwill to climb God's stairway to heaven. While helping policewoman Angela Dodson (Rachel Weisz) investigate her identical twin's apparent suicide, Constantine becomes caught up in a supernatural plot involving both demonic and angelic forces. Based on the DC/Vertigo ""Hellblazer"" comics.","Despite solid production values and an intriguing premise, Constantine lacks the focus of another spiritual shoot-em-up: The Matrix.","['A grab bag of bits from the whole demons-and-angels spectrum.', 'Blazes few new trails and bogs down in a confusing narrative muddle.', ""Constantine's incoherent plotting ruins the comicbook's frazzled, hard-bitten edge."", 'Entirely beyond redemption.', 'Halfway through Constantine, a fully clad Keanu Reeves steps into a shallow pail of water, sits on a chair next to it and holds a cat in his lap.', 'I deeply loathe the Heaven-and-Hell genre to which this cinematic comic-book spectacular belongs.', ""It's just so awful that the crew must have been snickering."", ""It's occasionally cheesy, sometimes enjoyable, intermittently scary, and constantly spiked with celestial blatherskite."", 'Keanu Reeves is -- let me just get this off my chest -- very good.', ""Maybe some of the audience should wonder if they aren't performing the Devil's work by sitting so quietly through movies that turn wonders into garbage."", 'Peaks early, then descends into portentous nonsense.', 'Reeves, meanwhile, has confidently entered his self-parodic period.', ""Swinton's presence proves as strange as the rest of this sometimes-stimulating but often-ludicrous endeavor."", 'Takes itself just seriously enough to put on a good show. Reeves earns some theatrical redemption, the demons put a scare into the waywardly righteous, and there are plenty of evil-duders left over for a sequel.', 'Those who can set aside their preconceptions will discover one of the more artfully designed comic-based films in some time.', 'Virtually anyone but Reeves would have made a better John Constantine.', 'Visuals and attitude -- not for kids.', ""Warner Bros. new DC Comic's adaptation Constantine is probably the best $80-million anti-smoking commercial ever made. Too bad the movie itself borderline stinks. Oh well, a girl can't have everything."", 'While lacking the richness of its source material, it remains an enjoyable, immoral and sometimes beautifully Gothic tale.', ""You can just picture the meeting: A few guys in Prada suits sit around an L.A. boardroom table going, 'The Matrix meets The Exorcist, huh . . .? With Keanu? I like it. No wait - I love it.'""]"
