title,year,genre,movie_description,critical_consensus,review
Tangled,2010,"['Kids, Family & Animation', 'Kids, Family & Animation', 'Comedy', 'Adventure', 'Drama & Romance', 'Fantasy']","When the kingdom's most-wanted bandit, Flynn Rider (Zachary Levi), hides in a convenient tower, he immediately becomes a captive of Rapunzel (Mandy Moore), the spire's longtime resident. Crowned with 70 feet of magical golden hair, she has been locked away for years and desperately wants freedom. The feisty teenager strikes a deal with Flynn, and together they begin a whirlwind adventure.","While far from Disney's greatest film, Tangled is a visually stunning, thoroughly entertaining addition to the studio's classic animated canon.","['A romance with songs, and none of them thankfully sung by animals.', 'As the film went on I liked it more and more.', ""Basically, it's the old Disney formula done with a lot more elan."", 'Brisk, witty and entertaining, but far from classic Disney.', ""Disney has a good hair day as the revamped story of Rapunzel leaps from the screen, and not just because it's made in 3-D."", 'I approach each new Disney film with a combination of eagerness and apprehension: will it be as good as I want it to be? Can ""the new guys"" carry the torch lit by Walt and...', ""I can't help liking a movie with chameleon reaction shots."", 'If this is what old-fashioned means, then bring it on.', ""It's no Whole New World, but with (mostly) smart lyrics and colourful characters, Disney's back in business."", ""It's the best Disney animation in years, and a natural counterpoint to the contemporary comic style that has come to dominate the industry."", ""Not just a pretty face; there's meat on its bones and a song in its heart besides. This deserves a place up there with the best of Disney's previous fairy tales."", 'Rapunzel gets a very ordinary updating in this Disney picture, raiding duller moments from the Shrek movies for ideas, and sporting a laboured selection of Broadway-style showtunes.', 'The Rapunzel story in 3D and digimation.', ""The long-tressed heroine is a rather bland and Valley Girlish, her handsome rescuer is a thieving fop, and the wicked stepmother who's kidnapped Rapunzel and imprisoned her in the tower looks quite a lot like Cher."", 'The prettiness comes with brains, and the whole production, like those newly eye-catching models of American-made cars, bespeaks resurgent confidence.', 'These are timeless themes -- domineering parent, sheltered child, dangerous boyfriend -- all woven together nicely by a crew of filmmakers from the Disney-Pixar trenches.', 'This is your basic, and very enjoyable, Disney princess musical, an empowerment tale to teach bright, dreamy girls how to grow to maturity -- and outgrow the adults in charge.', 'This snappy role reversal may or may not appeal to young men, but it inspires some classic knockabout screwball comedy and an exciting, vertiginous escape sequence.', 'While it lasts, the magic works.']"
The Hangover Part II,2011,['Comedy'],"Two years after the disastrous events in Las Vegas, it is now Stu's (Ed Helms) turn to walk down the aisle. Since his bride is from Thailand, Stu decides to hold the wedding there. Desperately hoping to avoid the mayhem of Doug's (Justin Bartha) bachelor party, Stu chooses what he thinks will be a safe option: an alcohol-free, prewedding brunch. But this being Thailand, and with Phil (Bradley Cooper) and Alan (Zach Galifianakis) again in attendance, anything can happen.","A crueler, darker, raunchier carbon copy of the first installment, The Hangover Part II lacks the element of surprise -- and most of the joy -- that helped make the original a hit.","['About halfway through, Galifianakis wails, ""I just wanted things to say the same!"" If Warner Brothers were being completely honest, that\'d be \'The Hangover Part II\'\'s ad line.', 'Directed, like the wildly successful first film, by Todd Phillips, it airlifts the original characters, premise, and story structure out of Vegas and plonks them down in Bangkok in near-identical form, save for a few instances of ante-upping.', ""Director Phillips whips along proceedings at break-neck speed, perhaps in the hope that we won't notice how all the quirks we loved the first time are nothing like as funny the second time"", ""I can't believe how precisely everything does happen again, except that what was fresh and surprising in Las Vegas turns rancid and predictable in Bangkok, where yet another wedding is scheduled to take place."", ""I can't dismiss the ugliness behind many of its antics."", 'If you want to see everything you saw in Hangover, only transplanted to Bangkok, with a drug-peddling simian and a missing human finger, then Hangover 2 is the movie for you.', ""It might not be quite as much fun as the first film but it's fun enough - and that's all that counts. Plus, there's a monkey in it."", ""It wasn't that bad and we laughed a lot."", ""It's a tribute to the filmmakers, particularly director and co-writer Todd Phillips, that the best way to approach The Hangover Part II is to talk about what it isn't. It isn't a typical sequel, either a watered-down encore or a muddled [extension]."", ""It's not with a sense of delight that you realise you're on exactly the same ride again but with dawning dismay."", 'Phillips and company are treading water, going through the motions in order to pick up a quick paycheck before moving onto something else.', ""The Hangover Part II isn't a dud, exactly -- some of it is very funny, and there are a few memorable jolts and outlandish dirty moments. But it feels, at times, like a routine adventure film set overseas."", 'The Hangover Part II sees the same ingredients shaken up in the kaleidoscope, but a less attractive and far less amusing pattern emerges.', 'The missing person, the seamy urban setting, the gradual accretion of clues: The Hangover films are, essentially, hard-boiled crime stories spun into comic depravity.', ""The premise and the execution are numbingly familiar, and what was funny and unexpected about a guys-bonding-under-pressure movie the first time around becomes: ''Are they kidding? Again?''"", 'The wickedly entertaining characters and actors each leave audiences in stitches as they go through the motions of an equally entertaining--albeit redone--plot that will thrill die-hard fans of the original.', 'Those who enjoyed The Hangover for its gross out insanity will appreciate this film, and it is possessed of a stronger ending than its predecessor, however anyone looking for novelty or a fresh take will be disappointed.', ""Unless moviegoers themselves are willing to shoulder some of the blame, it's useless to try and figure out why The Hangover Part II is so bad. The film only exists because, after the hilarious 2009 movie broke box-office records for an R-rated comedy..."", ""Unless moviegoers themselves are willing to shoulder some of the blame, it's useless to try and figure out why The Hangover Part II is so bad. The film only exists because, after the hilarious 2009 movie..."", 'Whereas The Hangover was borderline outrageous as it stacked one mesmerizing vulgarity atop the next, this second exercise in bad manners (presumably of four) feels rote in comparison.']"
"Monsters, Inc.",2001,"['Comedy', 'Kids, Family & Animation', 'Kids, Family & Animation', 'Adventure', 'Fantasy']","Monsters Incorporated is the largest scare factory in the monster world, and James P. Sullivan (John Goodman) is one of its top scarers. Sullivan is a huge, intimidating monster with blue fur, large purple spots and horns. His scare assistant, best friend and roommate is Mike Wazowski (Billy Crystal), a green, opinionated, feisty little one-eyed monster. Visiting from the human world is Boo (Mary Gibbs), a tiny girl who goes where no human has ever gone before.","Clever, funny, and delightful to look at, Monsters, Inc. delivers another resounding example of how Pixar elevated the bar for modern all-ages animation.","[""Another chance to see Pixar's most dazzling premise, now spruced up with a third dimension."", 'Brighter and more exuberant than Shrek, this would be a worthy winner of the first animation Oscar.', 'Cute, kid-friendly monster movie; may scare sensitive kids.', 'I enjoyed it.', 'If anything, it improves with age.', 'If history is any guide, you and your family - whether young or old - will probably want to see ""Monsters University"" over and over.', 'It may be harder nowadays to dazzle audiences with fancy visual effects, but Monsters, Inc. 3D proves that smart, imaginative storytelling still does the trick every time.', ""It's a terrific piece of work: smart, inventive and executed with state-of-the-art finesse."", ""It's in the visuals that 'Monsters Inc' comes to life, from the jazzy, Norman McLaren influenced opening to the hilarious, shakycam amateur-dramatic recap over the closing credits."", 'Most of the charm of ""Monsters Inc."" comes from its vocal cast.', ""Not even the opportunistic 3D-ification can squander the pure delight of the film's meticulously detailed world of ragtag creatures."", ""Pixar's soaringly lovely fourth feature ..."", 'Staggeringly generous with its witty lines, its allusions, above all with its sheer visual spectacle.', 'The analogy to our dependence on, say, oil is soon abandoned, the better to blur the distinction between abstract and concrete--something older viewers of this 2001 animated adventure may appreciate more than younger ones.', 'The balance tilts towards action and gags, and does them gloriously.', 'The excellent basic ideas have yielded too few twists and dramatic junctures to keep the picture flying at the level at which it starts.', ""The good guys are those who realize that laughter is stronger than fear. That's a message worth taking to heart these jittery days."", 'The movie itself stands up well, even from an adult, two-dimensional perspective.', ""The uses of enchantment haven't changed; kids still need, maybe more than ever, the special comfort of fabulous threats they can control."", 'Triumphantly reconfirms the geniuses at Pixar as the 800-pound gorillas of modern animation and the reigning kings of family entertainment.']"
Ted,2012,"['Comedy', 'Fantasy']","When John Bennett (Mark Wahlberg) was a little boy, he made a wish that Ted (Seth MacFarlane), his beloved teddy bear, would come alive. Thirty years later, foul-mouthed Ted is still John's constant companion, much to the chagrin of Lori (Mila Kunis), John's girlfriend. Though Lori's displeasure is exacerbated by the pair's constant consumption of beer and weed, she's not the one who's most disappointed with John; it may take the intervention of John's boyhood toy to help him grow up at last.","Ted's ""romance versus bromance"" plot is familiar, but the film's held aloft by the high-concept central premise and a very funny (albeit inconsistent) script.","['""Ted"" is so lazy you want to kick the stuffing out of it.', 'As unabashedly idiotic movie comedies go, Ted goes fairly well.', 'Crass, supremely silly and very, very funny, Ted is the comedy of the summer.', ""Everything goes on too long -- Ted's carousing, Lori's watchful waiting, John's wistful indecision."", 'I expected ""Ted"" to be a one-joke movie, but it\'s got ideas spilling out of its seams.', ""I tried to resist but couldn't."", 'It is a film that seems to have an endless middle.', ""It's a goofy premise pursued with crass -- as well as sentimental -- relish."", ""Laughter doesn't lie. I loved Ted and found it irresistibly funny and hugely enjoyable."", ""Sure, MacFarlane, you can make us laugh, but it's time to grow up. Seriously."", 'Ted has nothing much to offer in terms of subtlety and sensitivity, but there are plenty of laughs.', 'The bear done good.', 'The film will probably be funnier if you go with a beer, a friend or perhaps - who knows? - your own dissolute soft toy companion.', ""The greatest compliment I can pay Seth MacFarlane's Ted is that although this is essentially one of those slacker, stoner comedies, and such comedies aren't really my thing... this did make me laugh quite a bit."", 'The idea of a toy that comes to life - and then won\'t go away - isn\'t a bad one. Too bad that ""Ted"" manages to overstay its welcome without ever really coming to life itself.', 'The plot is simply a shaky frame on which to hang drug and sex jokes and numerous pop-culture references.', ""There's just enough mileage in the gag to keep the movie spluttering through an energetic series of pop-cultural references and broadly staged orgies of profanity."", 'This is ersatz subversion for an audience secretly terrified of the real thing.', ""Underneath the matted fur of the movie's foul-mouthed bear beats a very real heart."", ""You'll feel the warmth and camaraderie of a Bostonian and his little sentient bear.""]"
Detective Chinatown 2,2018,"['Comedy', 'Adventure']","When John Bennett (Mark Wahlberg) was a little boy, he made a wish that Ted (Seth MacFarlane), his beloved teddy bear, would come alive. Thirty years later, foul-mouthed Ted is still John's constant companion, much to the chagrin of Lori (Mila Kunis), John's girlfriend. Though Lori's displeasure is exacerbated by the pair's constant consumption of beer and weed, she's not the one who's most disappointed with John; it may take the intervention of John's boyhood toy to help him grow up at last.","Ted's ""romance versus bromance"" plot is familiar, but the film's held aloft by the high-concept central premise and a very funny (albeit inconsistent) script.","['At two-plus hours, the joke goes on for way too long. But Detective Chinatown 2 is a case worth taking.', 'At two-plus hours, the joke goes on for way too long. But Detective Chinatown 2 is a case worth taking.', ""Here's hoping the third outing, which will take the main characters to Tokyo, returns to the amiable, artful high jinks of the first."", ""Here's hoping the third outing, which will take the main characters to Tokyo, returns to the amiable, artful high jinks of the first."", ""I can't give the film my most immediate recommendation, but for anyone concerned about the case of the missing modern buddy cop comedy, Detective Chinatown 2 is a noteworthy placeholder."", ""I can't give the film my most immediate recommendation, but for anyone concerned about the case of the missing modern buddy cop comedy, Detective Chinatown 2 is a noteworthy placeholder."", ""It isn't remotely subtle."", ""It isn't remotely subtle."", 'The script blasts through reams of plot with lightning dialogue, and even if you have a fast eye for subtitles you may come to the end of the movie with no clear idea what happened.', 'The script blasts through reams of plot with lightning dialogue, and even if you have a fast eye for subtitles you may come to the end of the movie with no clear idea what happened.', ""This loud, goofy, comic-book-bright sequel to Chen Sicheng's 2015 buddy comedy works as a loose riff on Sherlock Holmes."", ""This loud, goofy, comic-book-bright sequel to Chen Sicheng's 2015 buddy comedy works as a loose riff on Sherlock Holmes."", 'Though less of a brainteaser than the original film, director-writer Chen Sicheng infuses Chinese color into a plot that solves crimes by using feng shui as clues, making things accessible and intriguing to local and international audiences alike.', 'Though less of a brainteaser than the original film, director-writer Chen Sicheng infuses Chinese color into a plot that solves crimes by using feng shui as clues, making things accessible and intriguing to local and international audiences alike.', 'What better way to celebrate Chinese new year than with this film? Erm ... actually, there are a number of activities that might be better.', 'What better way to celebrate Chinese new year than with this film? Erm ... actually, there are a number of activities that might be better.']"
Detective Chinatown 2,2018,"['Comedy', 'Adventure']","Aladdin is a lovable street urchin who meets Princess Jasmine, the beautiful daughter of the sultan of Agrabah. While visiting her exotic palace, Aladdin stumbles upon a magic oil lamp that unleashes a powerful, wisecracking, larger-than-life genie. As Aladdin and the genie start to become friends, they must soon embark on a dangerous mission to stop the evil sorcerer Jafar from overthrowing young Jasmine's kingdom.","Aladdin retells its classic source material's story with sufficient spectacle and skill, even if it never approaches the dazzling splendor of the animated original.","['At two-plus hours, the joke goes on for way too long. But Detective Chinatown 2 is a case worth taking.', 'At two-plus hours, the joke goes on for way too long. But Detective Chinatown 2 is a case worth taking.', ""Here's hoping the third outing, which will take the main characters to Tokyo, returns to the amiable, artful high jinks of the first."", ""Here's hoping the third outing, which will take the main characters to Tokyo, returns to the amiable, artful high jinks of the first."", ""I can't give the film my most immediate recommendation, but for anyone concerned about the case of the missing modern buddy cop comedy, Detective Chinatown 2 is a noteworthy placeholder."", ""I can't give the film my most immediate recommendation, but for anyone concerned about the case of the missing modern buddy cop comedy, Detective Chinatown 2 is a noteworthy placeholder."", ""It isn't remotely subtle."", ""It isn't remotely subtle."", 'The script blasts through reams of plot with lightning dialogue, and even if you have a fast eye for subtitles you may come to the end of the movie with no clear idea what happened.', 'The script blasts through reams of plot with lightning dialogue, and even if you have a fast eye for subtitles you may come to the end of the movie with no clear idea what happened.', ""This loud, goofy, comic-book-bright sequel to Chen Sicheng's 2015 buddy comedy works as a loose riff on Sherlock Holmes."", ""This loud, goofy, comic-book-bright sequel to Chen Sicheng's 2015 buddy comedy works as a loose riff on Sherlock Holmes."", 'Though less of a brainteaser than the original film, director-writer Chen Sicheng infuses Chinese color into a plot that solves crimes by using feng shui as clues, making things accessible and intriguing to local and international audiences alike.', 'Though less of a brainteaser than the original film, director-writer Chen Sicheng infuses Chinese color into a plot that solves crimes by using feng shui as clues, making things accessible and intriguing to local and international audiences alike.', 'What better way to celebrate Chinese new year than with this film? Erm ... actually, there are a number of activities that might be better.', 'What better way to celebrate Chinese new year than with this film? Erm ... actually, there are a number of activities that might be better.']"
Madagascar,2005,"['Adventure', 'Kids, Family & Animation', 'Comedy', 'Kids, Family & Animation']","Alex the lion is the king of the urban jungle, the main attraction at New York's Central Park Zoo. He and his best friends -- Marty the zebra, Melman the giraffe and Gloria the hippo -- have spent their whole lives in blissful captivity before an admiring public and with regular meals provided for them. Not content to leave well enough alone, Marty lets his curiosity get the better of him and makes his escape -- with the help of some prodigious penguins -- to explore the world.","Though its story is problematic in spots and its humor is hit-or-miss for the adult crowd, Madagascar boasts impressive visuals and enough spunky charm to keep children entertained.","['Boring and bedraggled.', 'Brilliantly written, animated and performed, it not only bridges the child-adult divide, but also makes its kid-friendly humor smart in its own way.', ""Doesn't really live up to the promise that the idea and voice talent deserve. But it's still spirited, amiable, featherweight summer fun."", ""Feels as if it has been created from an animator's template."", 'Highly recommended for kids and adults.', ""It is winning; so much fun I can't wait to see Madagascar again. Heck, I might even go pick up a stuffed penguin."", ""It paints itself into a very bizarre corner because at first, they are all friends and then all of a sudden they revert to being more like real animals. How do you do that and make it funny? Well, you don't."", ""It's a brisk and lively getaway with genuine personality."", ""Lacking any meat on its bones, ['Madagascar'] is a cartoon about nothing. Not that there's anything wrong with that."", 'Lame scatalogical gags and worn pop-culture parodies abound, but the CGI animation romp is somewhat redeemed by the scene-stealing appearances of several supporting characters.', 'Like its jailbreak protagonists, the film grows more ambitious outside the confines of the zoo and truly takes off when the four best friends accidentally wash up on the shores of Madagascar.', 'Madagascar is great good fun, not only because the filmmakers have enlisted some wonderful voice talent but also because the visuals truly are marvelous.', 'Take the kids. Find a globe. Do some teaching.', 'The fact is, apart from certain superficial visual distinctions, virtually all of the recent studio-produced, star-voiced computer-animated movies feel like they could have been produced on different assembly lines in the same factory.', 'The film ends with an obvious bid for a sequel, and why not? Madagascar and its charming critters deserve an encore.', 'The latest DreamWorks Animation picture that leaves you jonesing for a little Pixar.', ""The tenor can be shrill, but there's no time to get bored. And on top of that, most of the gags actually work."", ""This doesn't signify progress for the computer-animated medium. If anything, it's regression."", 'What makes it good is that the story is a kind of parable that suggests some seriousness beneath the surface, even sadness.', ""[It] looks stunning, but it's an ill-conceived mess that plays like two movies awkwardly spliced together.""]"
Ralph Breaks the Internet,2018,"['Comedy', 'Kids, Family & Animation', 'Kids, Family & Animation', 'Adventure']","Video game bad guy Ralph and fellow misfit Vanellope von Schweetz must risk it all by traveling to the World Wide Web in search of a replacement part to save Vanellope's video game, ""Sugar Rush."" In way over their heads, Ralph and Vanellope rely on the citizens of the internet -- the netizens -- to help navigate their way, including an entrepreneur named Yesss, who is the head algorithm and the heart and soul of trend-making site BuzzzTube.","Ralph Breaks the Internet levels up on its predecessor with a funny, heartwarming sequel that expands its colorful universe while focusing on core characters and relationships.","['""Ralph Breaks the Internet"" doesn\'t have anything new to say about our online behavior; it just wants us to log on and tune out.', 'A persistent kowtowing to corporate interests flattens the satire. More logos will fly at punters during the film than they are likely to encounter in the preceding commercials.', ""As bold and smart a story about what it means to live online as any we've ever come up with..."", ""Best of all, the directors don't shy away from the ending their story demands."", ""Conceptually, it's rather ingenious, with well-aimed barbs at abusive commenter culture and social-media narcissism that adds up to a welcome moral for small fry..."", ""I am happy to say that the misogynists' worst fears were realized. This is very much a movie whose female characters are equal to their male counterparts..."", ""It's not every animation that features an eBay-spoofing riff involving a corn chip shaped like Beyoncé."", ""It's pretty incredible to see how the filmmakers easily and boldly slip concepts right from the therapist's office into the wild rumpus through the internet."", ""Movies don't get more timely than Ralph Breaks the Internet - an exhilarating yet dismaying sequel to 2012's Wreck It Ralph, for my money easily the smartest and most endearing Disney animated feature of recent years."", 'Ralph Breaks the Internet is less a film, more a commercial. Game over, everyone.', ""Ralph Breaks the Internet is, without a doubt, the best film made about the lives of computer programs since the Wachowskis' Matrix sequels; I mean this as a glowing compliment."", ""Ralph Breaks the Internet takes the characters into a whole new world, relying on Disney tropes of old and moving them into an environment that's changed so much since video games were in vogue."", ""Ralph Breaks the Internet works because it doesn't pander, and it doesn't simplify."", ""Ralph Breaks the Internet would've been a fun but soulless movie if not for its nuanced and necessary story about friendship."", 'Somewhere between Ready Player One and The Emoji Movie, summoning up a zero-gravity spectacle of dazzling colours and vertiginous perspectives, a featureless and inert mashup of memes, brands, avatars and jokes.', 'Still, beneath the plethora of in-joke Easter eggs and already dated social media gags lies a film on a Pixar-like mission to make parents blub into their popcorn.', 'Surprisingly enjoyable, if not predictable.', ""The nuanced friendship between Ralph and Vanellope remains the most engaging part of the film, once you've overcome the slight weirdness of a hulking man being best mates with a small girl."", ""The opposing trajectories of Ralph and Vanellope's friendship, fueled by their mutual insecurities and hurt, gives Ralph Breaks the Internet the little bit of heart it needs to keep from becoming mere product."", '[A] charming buddy comedy...']"
